concept,cluster_graph,cluster_embed,degree,pagerank
non,104,3,6,0.002823254709861605
excluded fees can include various types of non,104,3,2,0.0009536220452763701
which are not reflected in the apr calculation,104,3,2,0.0009536220452763701
case of bond v barrow haematite steel co,104,3,1,0.0005483347459893907
in the canadian case of burland v earle,104,3,1,0.0005483347459893907
the principle of non,104,3,1,0.0005483347459893907
the australian case of miles v sydney meat,104,3,1,0.0005483347459893907
currency,105,3,5,0.0028042303182561385
exclusive power to issue all forms of currency,105,3,1,0.0006260975565268138
it regulates the production of currency by banks,105,3,1,0.0006260975565268138
alternative currencies for its own area of circulation,105,3,1,0.0006260975565268138
a country or group of countries,105,3,1,0.0006260975565268138
but values in currency,105,3,1,0.0006260975565268138
unit of account for payments to government agencies,106,3,2,0.001442897342175311
and each type has limited boundaries of acceptance,106,3,1,0.0007622308541348967
either chosen by users or decreed by governments,106,3,1,0.0007622308541348967
the metal,107,3,2,0.001442897342175311
the value of a coin could be determined,107,3,1,0.0007622308541348967
tested for their fine weight of the metal,107,3,1,0.0007622308541348967
and sometimes also defined a unit of account,108,3,3,0.0018966750008689202
account,108,3,1,0.0006866012443526283
while coins of copper or silver,108,3,1,0.0006866012443526283
or some mixture of them,108,3,1,0.0006866012443526283
of new world silver after the spanish conquests,109,3,2,0.001442897342175311
of central europe made silver relatively less valuable,109,3,1,0.0007622308541348967
metals varied greatly between different eras and places,109,3,1,0.0007622308541348967
premodern china,110,3,1,0.0009891196834817012
coins led to the introduction of paper money,110,3,1,0.0009891196834817012
credit,111,3,2,0.001442897342175311
and merchants include the earliest uses of credit,111,3,1,0.0007622308541348967
the transfer of credit and debt,111,3,1,0.0007622308541348967
facilitated loans of gold or silver at interest,112,3,5,0.0028042303182561385
of gold or silver coins rather than notes,112,3,1,0.0006260975565268138
the advantages of paper currency were numerous,112,3,1,0.0006260975565268138
the lender until someone else redeemed the note,112,3,1,0.0006260975565268138
it allowed a division of currency into credit,112,3,1,0.0006260975565268138
paper currency were numerous,112,3,1,0.0006260975565268138
first,113,3,3,0.0018966750008689208
company is generating healthy profits from its operations,113,4,1,0.0007942479027187033
without paying a penalty,113,3,1,0.0007942479027187033
than they had specie to back them with,113,3,1,0.00047130792762047926
of paper money was also associated with wars,114,3,3,0.0018966750008689202
paper money was also associated with wars,114,3,1,0.0006866012443526283
and financing of wars,114,3,1,0.0006866012443526283
regarded as part of maintaining a standing army,114,3,1,0.0006866012443526283
remained in circulation occupied the efforts of inflationists,115,3,2,0.001442897342175311
parallel use of both metals is called bimetallism,115,3,1,0.0007622308541348967
both metals is called bimetallism,115,3,1,0.0007622308541348967
silver they received but paying out in notes,116,3,1,0.0009891196834817012
notes,116,3,1,0.0009891196834817012
developed a polymer currency in the,117,3,2,0.001442897342175311
it went into circulation on the nation,117,3,1,0.0007622308541348967
research organisation developed a polymer currency in the,117,3,1,0.0007622308541348967
over,118,3,4,0.0023504526595625277
cap companies have market capitalizations of over,118,3,1,0.0011224185353723548
financial information may not be accurate and can,118,3,1,0.0005266242621957106
the life span of banknotes and reduces counterfeiting,118,3,1,0.0004730514801389551
polymer currency is used in over,118,3,1,0.0004730514801389551
is based on the concept of lex monetae,119,3,1,0.0009891196834817012
the concept of lex monetae,119,3,1,0.0009891196834817012
the dollar sign in particular has many uses,120,3,1,0.0009891196834817012
particular has many uses,120,3,1,0.0009891196834817012
the,121,3,15,0.007028111796082366
would be,121,3,3,0.0016072754834636008
new generation of millionaires from investments in technology,121,4,1,0.0009319487233008112
and research capabilities accessible to the general public,121,3,1,0.0008739057032431404
that had commenced more than a century ago,121,3,1,0.0008739057032431404
such as robinhood,121,3,1,0.0008739057032431404
frequently used currencies in world payments in july,121,3,2,0.0006785247032690341
s estimates of the,121,3,2,0.0006785247032690341
the resulting capital gain would be,121,3,1,0.0006694092212025558
second,121,3,1,0.00044825688948688775
the monthly payments,121,3,1,0.0004088885868624055
that could be computed easily in their heads,121,3,1,0.0003902138694292169
it easier to compare lenders and loan options,121,3,1,0.0003902138694292169
amongst the traders in its monopolized salt industry,121,3,1,0.0003902138694292169
a fact observed by david hume in the,121,3,1,0.0003902138694292169
is the sum that the testimony of the,121,3,1,0.0003902138694292169
largest publicly listed companies in the country,121,3,1,0.0003902138694292169
these consist of the,121,3,1,0.0003902138694292169
the former,122,3,3,0.0018966750008689202
in exchange rates are determined by the market,122,3,1,0.0006866012443526283
supply and demand at a static exchange rate,122,3,1,0.0006866012443526283
model,122,3,1,0.0006866012443526283
international investing,123,3,2,0.001442897342175311
required in order to convert into other currencies,123,3,1,0.0007622308541348967
there are significant restrictions on international investing,123,3,1,0.0007622308541348967
trade in goods and services,124,6,5,0.0028042303182561385
different currencies determines the exchange ratio between currencies,124,3,1,0.0006260975565268138
three aspects of trade in goods and services,124,6,1,0.0006260975565268138
goods and services circulating in the country,124,6,1,0.0006260975565268138
and services and the price of export trade,124,6,1,0.0006260975565268138
goods and services,124,6,1,0.0006260975565268138
key benefits include access to diversified,125,3,1,0.0009891196834817012
funds tailored to different objectives and risk tolerances,125,3,1,0.0009891196834817012
ratios,126,3,3,0.00152118743198422
dominate the profitability of capital and economic development,126,3,2,0.0008202092684719795
repayment capacity and credit rating of the country,126,3,2,0.0008202092684719795
and sales,126,3,1,0.0007948727649986268
strict conditions for countries to achieve currency convertibility,127,3,1,0.0009891196834817012
good way for countries to improve their economies,127,3,1,0.0009891196834817012
economy be in a normal and orderly state,128,3,1,0.0009891196834817012
a normal and orderly state,128,3,1,0.0009891196834817012
to eliminate the foreign exchange shortage,129,3,1,0.0009891196834817012
the government needs adequate international reserves,129,3,1,0.0009891196834817012
declared bitcoin,130,3,1,0.0009891196834817012
be a commodity under the commodity exchange act,130,3,1,0.0009891196834817012
money,131,3,4,0.002350452659562529
order to protect and preserve the constitutional currency,131,3,1,0.0006487864394614943
recognizes the time value of money,131,3,1,0.0006487864394614943
core formula for the time value of money,131,3,1,0.0006487864394614943
the other formulas is derived from this formula,131,4,1,0.0006487864394614943
is a violation of federal law for individuals,132,3,2,0.001442897342175311
official coinage and currency of the united states,132,3,1,0.0007622308541348967
of federal law for individuals,132,3,1,0.0007622308541348967
of this is the argentinian economic crisis of,133,0,2,0.001442897342175311
on some of the characteristics of local currencies,133,3,1,0.0007622308541348967
this is the argentinian economic crisis of,133,0,1,0.0007622308541348967
be seen as an implication of the later,134,3,2,0.001442897342175311
of the later,134,3,1,0.0007622308541348967
developed concept of time preference,134,3,1,0.0007622308541348967
the case of a debt,135,3,2,0.001442897342175311
in the case of a debt,135,3,1,0.0007622308541348967
in the case of a financial asset,135,3,1,0.0007622308541348967
the assumption that inflation would be zero percent,136,3,1,0.0009891196834817012
that inflation would be zero percent,136,3,1,0.0009891196834817012
for the present value of a future sum,137,3,2,0.001442897342175311
amount equal to the time value of money,137,3,1,0.0007622308541348967
a likely stream of income in the future,137,3,1,0.0007622308541348967
the present value of the future cash flows,138,3,1,0.0009891196834817012
the future cash flows,138,3,1,0.0009891196834817012
most cases,139,1,2,0.0014428973421753107
well as from the day the fund opened,139,4,1,0.0011305485951024817
or a spreadsheet,139,3,1,0.00039391311316731186
an annuity that makes one payment per year,140,3,1,0.0009891196834817012
i will be the annual interest rate,140,3,1,0.0009891196834817012
n is the number of periods,141,3,2,0.001442897342175311
of the individual payments in each compounding period,141,3,1,0.0007622308541348967
the individual payments in each compounding period,141,3,1,0.0007622308541348967
in the earlier formula for a growing perpetuity,142,3,1,0.0009891196834817012
the earlier formula for a growing perpetuity,142,3,1,0.0009891196834817012
practice,143,3,2,0.0014428973421753105
before making an investment decision,143,3,1,0.0009668518213391106
approach is subject to various qualifications and modifications,143,3,1,0.0005576098869306829
such as,144,3,2,0.0014428973421753107
plans and manage trusts and other retirement accounts,144,3,1,0.0010691623049412175
ratios can be expressed as a decimal value,144,3,1,0.000455299403328576
aspect of the business which the ratio measures,145,3,1,0.0009891196834817012
the business which the ratio measures,145,3,1,0.0009891196834817012
investment for shareholders,146,3,2,0.001442897342175311
concerned with the return on investment for shareholders,146,3,1,0.0007622308541348967
and the value of an investment in company,146,3,1,0.0007622308541348967
is it good or bad,147,3,1,0.0009891196834817012
is needed to answer questions such as,147,3,1,0.0009891196834817012
see below,148,3,2,0.0015053487641707428
from index investing and etfs,148,4,1,0.0012146566604817675
otherwise,148,3,2,0.0007635827064816345
the firm will be unable to raise capital,148,3,1,0.00047289060279265976
bonds,149,3,2,0.001442897342175311
because there are many different types of bonds,149,3,1,0.0007622308541348967
dramatically depending on where and when they invest,149,3,1,0.0007622308541348967
goods sold,150,6,3,0.0012841202908358926
cost of goods sold,150,6,3,0.0012841202908358926
or cost of sales,150,3,2,0.0006941190761275102
excess salaries in the case of private companies,150,3,2,0.0006941190761275102
the firm,151,3,3,0.0018966750008689202
s use of resources,151,3,1,0.0006866012443526283
efficiency ratios measure the effectiveness of the firm,151,3,1,0.0006866012443526283
to pay for a share of the firm,151,3,1,0.0006866012443526283
finally,152,3,2,0.0014428973421753107
t neglect life insurance and disability insurance,152,3,1,0.0011305485951024817
uses more debt financing relative to equity financing,152,3,1,0.00039391311316731186
but dividend payments to shareholders are not,153,1,1,0.0009891196834817012
interest payments to creditors are tax,153,3,1,0.0009891196834817012
the risk of defaulting on interest payments increases,154,4,1,0.0009891196834817012
defaulting on interest payments increases,154,4,1,0.0009891196834817012
particular,155,3,4,0.0023504526595625286
importance to so many americans and their retirements,155,3,1,0.0012921816369548013
roe is used developing estimates of a stock,155,3,1,0.0004343213736303917
and hence the growth rate of its dividends,155,3,1,0.0004343213736303917
for undervalued shares relative to their fundamental potential,155,3,1,0.0004343213736303917
result,156,3,1,0.0009891196834817012
or the dividend discount model valuation result,156,3,1,0.0009891196834817012
the company,157,4,10,0.004155625952582215
this approach focuses on the company,157,3,1,0.001145846957986952
the record date will be paid the dividend,157,1,3,0.0009692356531146838
furnishes an objective measure of the company,157,3,2,0.0006917159374562759
along with an assessment of the company,157,3,2,0.0006917159374562759
which could then,157,4,1,0.0006882534642300224
shareholders registered in the company,157,3,2,0.0006723547519035017
of this date will not receive the dividend,157,1,2,0.0006723547519035017
third of the company,157,3,1,0.0003977377038884294
to the actual cash flow of the company,157,3,1,0.0003977377038884294
company is not an expense of the company,157,3,1,0.0003977377038884294
list of business and finance abbreviations,158,3,3,0.0018966750008689202
return on assets,158,3,1,0.0006866012443526283
return on brand,158,3,1,0.0006866012443526283
business and finance abbreviations,158,3,1,0.0006866012443526283
public exchanges,159,3,1,0.0009891196834817012
are bought and sold predominantly on public exchanges,159,3,1,0.0009891196834817012
the issuing company,160,4,2,0.001442897342175311
owns relative to the number of outstanding shares,160,3,1,0.0007622308541348967
is considered an owner of the issuing company,160,4,1,0.0007622308541348967
is legally separated from the property of shareholders,161,4,2,0.001442897342175311
shareholders,161,3,1,0.0007622308541348967
liability of both the corporation and the shareholder,161,3,1,0.0007622308541348967
you the right to vote in shareholder meetings,162,3,1,0.0009891196834817012
shareholder meetings,162,3,1,0.0009891196834817012
they cause their shares to appreciate in value,163,3,2,0.001442897342175311
stock buybacks,163,3,1,0.0007622308541348967
corporations can also engage in stock buybacks,163,3,1,0.0007622308541348967
return for periodic payments,164,3,1,0.0009891196834817012
to the company in return for periodic payments,164,3,1,0.0009891196834817012
generally,165,3,2,0.0014428973421753105
quantitative and qualitative,165,3,1,0.0009668518213391106
and contingent claim valuation,165,3,1,0.0005576098869306829
based on the observation of market prices of,166,3,1,0.0009891196834817012
the observation of market prices of,166,3,1,0.0009891196834817012
significantly because of necessary judgment and differing assumptions,167,3,2,0.001442897342175311
necessary judgment and differing assumptions,167,3,1,0.0007622308541348967
users of valuations benefit when key information,167,3,1,0.0007622308541348967
its assets at fair value,168,3,1,0.0009891196834817012
show some of its assets at fair value,168,3,1,0.0009891196834817012
today,169,3,2,0.001442897342175311
one year is worth less than,169,5,1,0.0007622308541348967
businesses to raise and deploy capital to firms,169,3,1,0.0007622308541348967
finance theory,170,3,1,0.0009891196834817012
risk and return of some sort of investment,170,3,1,0.0009891196834817012
using the discounted cash flow method,171,3,1,0.0009891196834817012
flows and interest rates in the capital markets,171,3,1,0.0009891196834817012
shares of stock or sales of entire firms,172,3,1,0.0009891196834817012
stock or sales of entire firms,172,3,1,0.0009891196834817012
the observed prices serve as valuation benchmarks,173,3,1,0.0009891196834817012
benchmarks,173,3,1,0.0009891196834817012
the u,174,3,8,0.0041655632943369695
crypto is legal in the u,174,3,1,0.0008582819998863162
agencies are slowly gaining ground in the industry,174,3,1,0.0008582819998863162
this method was first described in the u,174,3,1,0.0005033249762042857
the first etf in the u,174,3,1,0.0005033249762042857
allows inclusion in individual savings accounts,174,3,1,0.0005033249762042857
income or capital gains tax on their returns,174,3,1,0.0005033249762042857
buying etfs in the u,174,3,1,0.0005033249762042857
the fund is fully regulated in the u,174,3,1,0.0005033249762042857
tangible assets,175,3,2,0.001442897342175311
the appraiser identify the value of tangible assets,175,3,1,0.0007622308541348967
estimate an appropriate return on those tangible assets,175,3,1,0.0007622308541348967
financing costs and recurring earnings,176,3,1,0.0009891196834817012
preliminary to the valuation,176,3,1,0.0009891196834817012
of early,177,3,2,0.001442897342175311
the valuation of early,177,3,1,0.0007622308541348967
due to their lack of established track records,177,3,1,0.0007622308541348967
of benchmark intangible assets can ever be observed,178,3,3,0.0018966750008689202
benchmark intangible assets can ever be observed,178,3,1,0.0006866012443526283
the cost of recreating the asset in question,178,3,1,0.0006866012443526283
of assets using either a present value model,178,3,1,0.0006866012443526283
some cases,179,1,6,0.002823254709861605
not need to pay taxes on these re,179,3,2,0.0009536220452763701
but in most cases they do,179,1,2,0.0009536220452763701
based techniques or decision trees may be applied,179,3,1,0.0005483347459893907
the distribution may be of assets,179,3,1,0.0005483347459893907
the tax liability in relation to the dividend,179,1,1,0.0005483347459893907
buy call options or become an options writer,179,3,1,0.0005483347459893907
a corporation,180,4,1,0.0009891196834817012
can give an indirect estimate of a corporation,180,4,1,0.0009891196834817012
regardless of the method,181,3,1,0.0009891196834817012
the method,181,3,1,0.0009891196834817012
research and development,182,3,1,0.0009891196834817012
these businesses are involved in research and development,182,3,1,0.0009891196834817012
general,183,3,10,0.004110580869589068
and the complexity and costs of extracting this,183,3,3,0.0010165147088839572
while higher risk yields higher returns,183,3,1,0.0009546796347717498
the united states is expressed as the periodic,183,3,2,0.0007254571269266063
the number of compounding periods in a year,183,3,2,0.0007254571269266063
result will be a function of the property,183,3,2,0.0007051512186812748
size and grade of the deposit in question,183,3,2,0.0007051512186812748
look at the following broad types of indicators,183,3,1,0.0006859090740219182
future compared to companies with a lower price,183,3,1,0.0004171385132720867
that investors are expecting higher growth of company,183,3,1,0.0004171385132720867
analysis in conjunction with other forms of research,183,3,1,0.0004171385132720867
standards stress the use of the cost approach,184,3,2,0.001442897342175311
the cost approach,184,3,1,0.0007622308541348967
of development of the mining property or project,184,3,1,0.0007622308541348967
the other hand,185,3,6,0.0032580079769497475
have positive theta,185,3,1,0.0011892262371304913
will impact stock value in a limited fashion,185,3,1,0.0004953207140583339
tax expense,185,3,1,0.0004953207140583339
same terms regardless of who is the counterparty,185,3,1,0.0004953207140583339
it is difficult to beat the market consistently,185,3,1,0.0004953207140583339
a stated price within a specific time frame,185,3,1,0.0004953207140583339
assumptions,186,3,1,0.0009891196834817012
bounds,186,3,1,0.0009891196834817012
net income less any reinvestment in regulatory capital,187,3,2,0.001442897342175311
of equity either free cash flow to equity,187,3,1,0.0007622308541348967
equity either free cash flow to equity,187,3,1,0.0007622308541348967
discounted at the weighted average cost of capital,188,3,1,0.0009891196834817012
which incorporates the cost of debt,188,3,1,0.0009891196834817012
mismarking,189,3,2,0.001442897342175311
when a rogue trader engages in mismarking,189,3,1,0.0007622308541348967
of the securities portfolio that he is managing,189,3,1,0.0007622308541348967
the stock price on open on the ex,190,3,1,0.0009891196834817012
open on the ex,190,3,1,0.0009891196834817012
to shareholders may be in cash,191,3,2,0.001442897342175311
distribution to shareholders may be in cash,191,3,1,0.0007622308541348967
issue of further shares or by share repurchase,191,3,1,0.0007622308541348967
it is the division of after,192,3,1,0.0009891196834817012
of after,192,3,1,0.0009891196834817012
the shareholders,193,3,2,0.001442897342175311
are shown in the shareholders,193,3,1,0.0007622308541348967
equity section on the company,193,3,1,0.0007622308541348967
companies usually pay dividends on a fixed schedule,194,3,1,0.0009891196834817012
a fixed schedule,194,3,1,0.0009891196834817012
preference shares,195,3,2,0.001442897342175311
or preferred stock in american english,195,3,1,0.0007622308541348967
usually fixed payments to holders of preference shares,195,3,1,0.0007622308541348967
of the value of the shares for almost,196,3,2,0.001442897342175311
years of existence,196,3,1,0.0007622308541348967
the value of the shares for almost,196,3,1,0.0007622308541348967
investment income of the shareholder,197,3,3,0.0018966750008689202
a form of investment income of the shareholder,197,3,1,0.0006866012443526283
as earned in the year they are paid,197,3,1,0.0006866012443526283
necessarily in the year a dividend was declared,197,3,1,0.0006866012443526283
shares of stock owned,198,3,2,0.001442897342175311
proportion to shares owned,198,3,1,0.0007622308541348967
are usually issued in proportion to shares owned,198,3,1,0.0007622308541348967
assets from the issuing corporation or another corporation,199,4,2,0.001442897342175311
property dividends or dividends in specie,199,3,1,0.0007622308541348967
specie,199,3,1,0.0007622308541348967
s interim financial statements,200,3,1,0.0009891196834817012
this declared dividend usually accompanies the company,200,3,1,0.0009891196834817012
date,201,3,4,0.0023504526595625286
you sell your shares before a certain date,201,3,1,0.0009823987640876532
the option expires worthlessly,201,3,1,0.000648786439461494
the put option expires worthlessly,201,3,1,0.000648786439461494
directors announces its intention to pay a dividend,201,3,1,0.0003151741148353348
shares on this day will receive the dividend,202,1,1,0.0009891196834817012
this day will receive the dividend,202,1,1,0.0009891196834817012
liquidity,203,3,1,0.0009891196834817012
professional management all make mutual funds attractive options,203,3,1,0.0009891196834817012
quarterly and monthly,204,3,1,0.0009891196834817012
the most usual dividend frequencies are yearly,204,1,1,0.0009891196834817012
of their portfolio as cash than other investments,205,3,1,0.0009891196834817012
liquidity and the ability to accommodate withdrawals,205,3,1,0.0009891196834817012
at a rate of a dollar per credit,206,3,2,0.001442897342175311
effectively eliminating the double taxation of company profits,206,3,1,0.0007622308541348967
a dollar per credit,206,3,1,0.0007622308541348967
part,207,3,2,0.001442897342175311
govern the payment of dividends to shareholders,207,3,1,0.0007622308541348967
the rules in part,207,3,1,0.0007622308541348967
the share price and dividend from the after,208,4,1,0.0009891196834817012
tax perspective of a shareholder,208,3,1,0.0009891196834817012
capital gains tcg is,209,3,2,0.001442897342175311
if the tax of capital gains tcg is,209,3,1,0.0007622308541348967
and the tax on dividends td is,209,3,1,0.0007622308541348967
the money on a string of stupid diworseifications,210,3,5,0.0028042303182561385
worse effects,210,3,1,0.0010058313443253085
came from peter lynch of fidelity investments,210,4,1,0.0005311641095771898
term for diversification that results in worse effects,210,3,1,0.0005311641095771898
position came from peter lynch of fidelity investments,210,4,1,0.0005311641095771898
that pay dividends is that companies that don,210,3,1,0.0005311641095771898
profitable companies exhibiting high levels of free cashflow,211,3,2,0.001442897342175311
being more durable in crashes or bear markets,211,4,1,0.0007622308541348967
crashes or bear markets,211,4,1,0.0007622308541348967
stock chooses to not participate in the buyback,212,3,2,0.001442897342175311
the price of the holder,212,3,1,0.0007622308541348967
is delayed until the sale of the shares,212,3,1,0.0007622308541348967
their earnings,213,3,1,0.0009891196834817012
all of them as dividends to their members,213,3,1,0.0009891196834817012
the lender,214,3,1,0.0009891196834817012
investors to assume the role of the lender,214,3,1,0.0009891196834817012
corporations often borrow to grow their business,215,3,1,0.0009891196834817012
or hire employees,215,3,1,0.0009891196834817012
or the face value of one bond,216,3,1,0.0009891196834817012
set at what is called their par value,216,3,1,0.0009891196834817012
yield to maturity is considered a long,217,3,1,0.0009891196834817012
yield but is expressed as an annual rate,217,3,1,0.0009891196834817012
an exchange,218,3,2,0.001442897342175311
can be bought and sold on an exchange,218,3,1,0.0007622308541348967
agreement that can be traded on an exchange,218,3,1,0.0007622308541348967
stocks,219,4,6,0.0032580079769497475
you can make investments in stocks,219,3,1,0.0009053557958736997
managers that enable investors to invest in stocks,219,3,1,0.0006530265147565516
assets based on when you plan to retire,219,3,1,0.0006530265147565516
investing by automatically adjusting their mix of stocks,219,3,1,0.0006530265147565516
some etfs track an index of stocks,219,3,1,0.0004006972336394034
investors to purchase a diversified portfolio of stocks,219,3,1,0.0004006972336394034
the largest and most diverse in europe,220,1,1,0.0009891196834817012
of the largest and most diverse in europe,220,1,1,0.0009891196834817012
undertakings for the collective investment in transferable securities,221,3,3,0.0018966750008689202
levied on ordinary share transactions in the u,221,4,1,0.0006866012443526283
ordinary share transactions in the u,221,4,1,0.0006866012443526283
listed etfs in the u,221,3,1,0.0006866012443526283
section of the wider market,222,3,3,0.0018966750008689202
