concept,cluster_graph,cluster_embed,degree,pagerank
of a fund that targets a representative cross,222,3,1,0.0006866012443526283
buying individual stocks,222,3,1,0.0006866012443526283
instead of buying individual stocks,222,3,1,0.0006866012443526283
such as trading volume or open interest figures,223,3,1,0.0009891196834817012
technical analysis most commonly applies to price changes,223,1,1,0.0009891196834817012
s strength and whether it will continue,224,3,1,0.0009891196834817012
others assess a trend,224,3,1,0.0009891196834817012
used technical indicators and charting patterns include trendlines,225,3,1,0.0009891196834817012
and momentum indicators,225,3,1,0.0009891196834817012
that the stock,226,3,1,0.0009891196834817012
differs from fundamental analysis in that the stock,226,4,1,0.0009891196834817012
strong form of the emh,227,3,1,0.0009891196834817012
are known as the weak form and semi,227,3,1,0.0009891196834817012
the trend,228,3,1,0.0009891196834817012
reinforcing the strength of the trend,228,3,1,0.0009891196834817012
throughout the day according to supply and demand,229,3,1,0.0009891196834817012
etf prices,229,3,1,0.0009891196834817012
is likely to underperform or experience significant downturns,230,3,1,0.0009891196834817012
by researching a company,230,3,1,0.0009891196834817012
of what you can learn from each one,231,4,2,0.001442897342175311
for a business to manipulate its cash situation,231,4,1,0.0007865495525181106
what you can learn from each one,231,4,1,0.0007379121557516829
significant source of quantitative data is financial statements,232,3,1,0.0009891196834817012
quantitative data is financial statements,232,3,1,0.0009891196834817012
about its financial performance,233,2,1,0.0009891196834817012
a company discloses information about its financial performance,233,2,1,0.0009891196834817012
mind when performing fundamental analysis,234,3,1,0.0009891196834817012
these items in mind when performing fundamental analysis,234,3,1,0.0009891196834817012
million in accounts receivable,235,3,3,0.0018966750008689202
in cash,235,3,1,0.0006866012443526283
million in marketable securities,235,3,1,0.0006866012443526283
million in cash,235,3,1,0.0006866012443526283
this hypothetical fundamental analysis,236,3,1,0.0009891196834817012
based on this hypothetical fundamental analysis,236,3,1,0.0009891196834817012
uses the same tools or views stocks similarly,237,3,1,0.0009891196834817012
a stock is valued differently than another analyst,237,3,1,0.0009891196834817012
while sellers commit to delivering it,238,3,1,0.0009891196834817012
to purchasing the underlying asset at contract expiration,238,3,1,0.0009891196834817012
types of contract can be used for speculation,239,3,1,0.0009891196834817012
contract can be used for speculation,239,3,1,0.0009891196834817012
futures contracts can be traded purely for profit,240,3,1,0.0009891196834817012
long as the trade is closed before expiration,240,3,1,0.0009891196834817012
expire on the third friday of the month,241,3,2,0.001442897342175311
of any and all contracts before trading them,241,3,1,0.0007622308541348967
the third friday of the month,241,3,1,0.0007622308541348967
cap that trades on a small exchange,242,3,1,0.0009891196834817012
stock exchange will have a very different risk,242,3,1,0.0009891196834817012
capital and use it for growth or profit,243,3,1,0.0009891196834817012
generating activities,243,3,1,0.0009891196834817012
trusts are another type of pooled investment,244,3,1,0.0009891196834817012
pooled investment,244,3,1,0.0009891196834817012
derivatives usually employ leverage,245,3,1,0.0009891196834817012
reward proposition,245,3,1,0.0009891196834817012
and currencies,246,3,1,0.0009891196834817012
commodities include metals,246,3,1,0.0009891196834817012
delegating research,247,3,1,0.0009891196834817012
mind paying for the convenience of delegating research,247,3,1,0.0009891196834817012
technology,248,4,3,0.0018966750008689206
the fund invests in technology,248,4,1,0.0007942479027187034
advisors are capable of more than selecting investments,248,3,1,0.0006327779151695914
with advancements in technology,248,4,1,0.0006327779151695914
find its roots in the period between the,249,3,3,0.0018966750008689202
first public markets connected investors with investment opportunities,249,4,1,0.0006866012443526283
investing has been around for millennia,249,3,1,0.0006866012443526283
concept of investing has been around for millennia,249,3,1,0.0006866012443526283
is often considered a common measure of risk,250,3,1,0.0009891196834817012
measure of risk,250,3,1,0.0009891196834817012
is considered riskier,251,3,1,0.0009891196834817012
speculation is considered riskier,251,3,1,0.0009891196834817012
shares of xyz stock for,252,3,1,0.0009891196834817012
xyz stock for,252,3,1,0.0009891196834817012
keep in mind,253,3,2,0.0010983082199699406
mind,253,3,2,0.0010983082199699406
that the money grows on a tax,253,3,2,0.0007707426105052215
investing in stocks,254,3,1,0.0009891196834817012
you can begin investing in stocks,254,3,1,0.0009891196834817012
is nothing to sneeze at,255,3,1,0.0009891196834817012
starting with,255,3,1,0.0009891196834817012
investment in amazon,256,3,1,0.0009891196834817012
amazon,256,3,1,0.0009891196834817012
are available at most financial institutions and don,257,1,1,0.0009891196834817012
t usually require a large amount to invest,257,3,1,0.0009891196834817012
with the best features and most competitive rates,258,1,1,0.0009891196834817012
savings accounts don,258,3,1,0.0009891196834817012
you can invest in real estate with,259,3,1,0.0009891196834817012
real estate with,259,3,1,0.0009891196834817012
reit stocks,260,3,1,0.0009891196834817012
you can invest in reit stocks,260,3,1,0.0009891196834817012
anytime during your working years,261,3,1,0.0009891196834817012
the better,261,3,1,0.0009891196834817012
you,262,3,2,0.001442897342175311
well as review it to monitor your progress,262,3,1,0.0007622308541348967
t have a use,262,3,1,0.0007622308541348967
retirement and where you,263,3,1,0.0009891196834817012
spend your time in retirement and where you,263,3,1,0.0009891196834817012
higher rate of return than a savings account,264,3,1,0.0009891196834817012
return than a savings account,264,3,1,0.0009891196834817012
with earned income can invest in an ira,265,3,1,0.0009891196834817012
an ira,265,3,1,0.0009891196834817012
this is a great variation on the ira,266,0,2,0.001442897342175311
for a lot of gain down the road,266,3,1,0.0007622308541348967
on the ira,266,3,1,0.0007622308541348967
a roth has other restrictions,267,3,1,0.0009891196834817012
related to income,267,3,1,0.0009891196834817012
compounding,268,3,2,0.001442897342175311
this is the principle of compounding,268,0,1,0.0007622308541348967
thanks to the joys of compounding,268,3,1,0.0007622308541348967
compound interest allows interest to earn interest,269,3,1,0.0009891196834817012
the more interest you will earn,269,3,1,0.0009891196834817012
tax retirement contributions,270,3,1,0.0009891196834817012
to set aside after,270,3,1,0.0009891196834817012
the most conservative investments,271,1,1,0.0009891196834817012
are one of the most conservative investments,271,1,1,0.0009891196834817012
in mortgage debt instead of well above water,272,3,1,0.0009891196834817012
equity loans and home equity lines of credit,272,3,1,0.0009891196834817012
coverage with a medicare advantage or medigap policy,273,3,1,0.0009891196834817012
you will have government,273,3,1,0.0009891196834817012
setting aside money now means you,274,3,1,0.0009891196834817012
ll have less to worry about later,274,3,1,0.0009891196834817012
secure online payments without the use of third,275,3,1,0.0009891196834817012
third,275,3,1,0.0009891196834817012
coin names differ from coin types,276,4,1,0.0009891196834817012
names differ from coin types,276,4,1,0.0009891196834817012
of the names of tokens in that category,277,3,3,0.0018966750008689202
t fall into one of these categories,277,3,1,0.0006866012443526283
the types you,277,3,1,0.0006866012443526283
here are some of the types you,277,3,1,0.0006866012443526283
custody that will contribute to an eventual framework,278,3,1,0.0009891196834817012
august,278,3,1,0.0009891196834817012
the country,279,3,1,0.0009891196834817012
that mining does not occur in the country,279,3,1,0.0009891196834817012
s markets in crypto,280,3,1,0.0009891196834817012
june,280,3,1,0.0009891196834817012
development for cryptocurrencies,281,3,2,0.001442897342175311
at the current stage of development for cryptocurrencies,281,3,1,0.0007622308541348967
decentralized system with cryptocurrencies and its practical implementation,281,3,1,0.0007622308541348967
the possibility of a single point of failure,282,3,3,0.0018966750008689202
a single point of failure,282,3,1,0.0006866012443526283
institution setting off a cascade of global crises,282,3,1,0.0006866012443526283
failure of large investment banks in the u,282,3,1,0.0006866012443526283
private keys and different forms of incentive systems,283,3,1,0.0009891196834817012
as proof of work or proof of stake,283,3,1,0.0009891196834817012
for mining only exceeding that of a household,284,3,1,0.0009891196834817012
a household,284,3,1,0.0009891196834817012
traded in public markets suffer from price volatility,285,4,1,0.0009891196834817012
public markets suffer from price volatility,285,4,1,0.0009891196834817012
expressed on investopedia are for informational purposes online,286,1,1,0.0009891196834817012
investopedia are for informational purposes online,286,1,1,0.0009891196834817012
made when one good is exchanged for another,287,3,1,0.0009891196834817012
is a microeconomic concept that reveals the trade,287,3,1,0.0009891196834817012
exercise feature is desirable and commands a premium,288,5,1,0.0009891196834817012
this is,288,5,1,0.0009891196834817012
for monthly contracts,289,3,1,0.0009891196834817012
it is usually the third friday,289,3,1,0.0009891196834817012
portfolios,290,3,2,0.0014428973421753105
but given the diversity of portfolios,290,3,1,0.0010253149548260284
to assess options risk and manage option portfolios,290,3,1,0.0004991467534437645
change in the underlying asset,291,3,2,0.001442897342175311
change between the option,291,3,1,0.0007622308541348967
represents the rate of change between the option,291,3,1,0.0007622308541348967
long a call option with a delta of,292,4,1,0.0009891196834817012
with a delta of,292,4,1,0.0009891196834817012
with a,293,3,2,0.0014428973421753107
s risks,293,3,1,0.000849925554365274
shares of stock to be fully hedged,293,3,1,0.0006745361539045193
theta is higher for at,294,3,1,0.0009891196834817012
money options,294,3,1,0.0009891196834817012
but also gamma in order to be delta,295,4,1,0.0009891196834817012
order to be delta,295,4,1,0.0009891196834817012
has a rho of,296,3,1,0.0009891196834817012
and a price of,296,3,1,0.0009891196834817012
the call option would increase to,297,3,1,0.0009891196834817012
value of the call option would increase to,297,3,1,0.0009891196834817012
if the investor,298,3,1,0.0009891196834817012
at the current market price for a profit,298,3,1,0.0009891196834817012
is less than the strike price at expiry,299,3,1,0.0009891196834817012
the investor can exercise the put,299,3,1,0.0009891196834817012
at the time of expiry,300,3,3,0.0018966750008689202
increase in the underlying stock price from,300,4,1,0.0006866012443526283
the option position would be,300,3,1,0.0006866012443526283
the profit on the option position would be,300,3,1,0.0006866012443526283
would expire worthlessly,301,3,1,0.0009891196834817012
premium,301,5,1,0.0009891196834817012
profits if the price of the stock declines,302,3,2,0.001442897342175311
the stock increases,302,4,1,0.0007622308541348967
profit if the price of the stock increases,302,3,1,0.0007622308541348967
sustainable mutual funds invest primarily in green technology,303,4,1,0.0009891196834817012
green technology,303,4,1,0.0009891196834817012
when you invest in a mutual fund,304,3,2,0.001216008512828506
ownership of all of the fund,304,3,2,0.001216008512828506
a mutual fund,304,3,2,0.0011826067196146197
managers to make investment decisions on your behalf,304,3,1,0.0006654873360684375
when someone buys shares in a mutual fund,304,3,1,0.0006654873360684375
indexes like the s,305,3,1,0.0009891196834817012
mirror the assets of indexes like the s,305,3,1,0.0009891196834817012
between strict value and growth investment is a,306,3,1,0.0009891196834817012
blend,306,3,1,0.0009891196834817012
share price by the number of shares outstanding,307,3,1,0.0009891196834817012
shares outstanding,307,3,1,0.0009891196834817012
